{
  "name": "wow-cc-marketplace",
  "owner": {
    "name": "wow-look-at-my-code"
  },
  "metadata": {
    "description": "Claude Code plugins by wow-look-at-my-code",
    "pluginRoot": "./plugins"
  },
  "plugins": [
    {
      "name": "html-demo",
      "source": "./html-demo",
      "description": "Create organized HTML demo pages with separate CSS and JS files",
      "category": "development",
      "keywords": [
        "html",
        "demo",
        "frontend",
        "prototype"
      ]
    },
    {
      "name": "jq",
      "source": "./jq",
      "description": "MCP server wrapping jq for JSON filtering, querying, and transforming without Bash permission prompts",
      "category": "development",
      "keywords": [
        "jq",
        "json",
        "filter",
        "query",
        "mcp"
      ]
    },
    {
      "name": "css-duplication",
      "source": "./css-duplication",
      "description": "Language server that flags identical CSS declaration blocks as diagnostics while you edit, so a rule copied under a new selector gets hoisted into the cascade instead of shipped",
      "category": "development",
      "keywords": [
        "css",
        "cascade",
        "duplication",
        "stylesheet",
        "refactor",
        "lsp",
        "diagnostics"
      ]
    },
    {
      "name": "finish-your-todos",
      "source": "./finish-your-todos",
      "description": "Blocks the Stop event while the TodoWrite list still has pending or in-progress items, so the assistant doesn't accidentally stop with work unfinished",
      "category": "development",
      "keywords": [
        "stop",
        "todo",
        "todowrite",
        "tasks",
        "autonomy",
        "hook"
      ]
    },
    {
      "name": "slopfix",
      "source": "./slopfix",
      "description": "The org's slop guards in one plugin: the common-checks gate as a language server and a write refusal, the counts and tombstones repairs, and the permission-seeking, blame-language, busy-poll and link-refs guards",
      "category": "development",
      "keywords": [
        "lint",
        "prose",
        "markdown",
        "lsp",
        "hook",
        "enforcement"
      ]
    },
    {
      "name": "grep",
      "source": "./plugins/grep",
      "description": "MCP server restoring the builtin Grep tool removed from Claude Code 2.1.117, with a grouped filenames_with_matches default mode",
      "category": "development",
      "keywords": [
        "grep",
        "ripgrep",
        "search",
        "regex",
        "mcp"
      ]
    },
    {
      "name": "glob",
      "source": "./plugins/glob",
      "description": "MCP server restoring the builtin Glob tool removed from Claude Code 2.1.117: ripgrep-backed file pattern matching sorted by mtime",
      "category": "development",
      "keywords": [
        "glob",
        "ripgrep",
        "files",
        "pattern",
        "mcp"
      ]
    },
    {
      "name": "docs",
      "source": "./docs",
      "description": "Corrective reference skills the model loads before editing file types it reliably gets wrong from stale training data (Dockerfile, compose.yaml)",
      "category": "development",
      "keywords": [
        "docs",
        "reference",
        "dockerfile",
        "docker-compose",
        "skills"
      ]
    },
    {
      "name": "repo-index",
      "source": "./plugins/repo-index",
      "description": "Suggests the repository that already solves the job: matches each prompt against an index generated from the GitHub API and injects the link and description, at most once per session",
      "category": "development",
      "keywords": [
        "repo",
        "index",
        "discovery",
        "suggest",
        "hook"
      ]
    }
  ]
}
